290M. Topics in Parallel Computation. *,"Investigates selected topics in applied parallel computation. Topics may include numerical methods, artificial intelligence and machine learning algorithms, graphics and image processing, systolic algorithms, and the interplay between hardware and algorithms. Students are encouraged to investigate and discuss the parallelization of their own research. Enrollment is restricted to graduate students. The Staff "
290N. Topics in Computer Performance. *,"Selected topics of current interest in the area of computer system performance. Subjects may include aspects of large systems, performability, computer networks, storage subsystems, and nontraditional approaches and are subject to periodic revision. Enrollment is restricted to graduate students. The Staff "
290V. Advanced Topics in Visual Computing. *,"Advanced course in image analysis and computer vision. Topics include motion analysis, multiple view geometry, 3D reconstruction, image-based rendering, vision-based graphics, face detection and recognition, tracking, image and video retrieval, and human-computer interface. Enrollment is restricted to seniors and graduate students. Enrollment limited to 20. The Staff "
293. Advanced Topics in Computer Engineering.,"A graduate seminar on a research topic in computer engineering which varies according to instructor. Possible topics include, but are not limited to, communication networks, data compression, special-purpose architectures, computer arithmetic, software reliability and reusability, systolic arrays. The Staff, M. Guthaus, E. Miller"
"296. Masters Project (2 credits). F,W,S",Independent completion of a masters project under faculty supervision. Students submit petition to sponsoring agency. Enrollment is restricted to graduate students. May be repeated for credit. The Staff 
"297. Independent Study or Research. F,W,S",Independent study or research under faculty supervision. Students submit petition to sponsoring agency. The Staff 
"299. Thesis Research. F,W,S",Thesis research conducted under faculty supervision. Students submit petition to sponsoring agency. The Staff 
"299F. Thesis Research (2 credits). F,W,S",Independent study or research under faculty supervision. Enrollment is restricted to graduate students. Recommended for part-time students. Students submit petition to sponsoring agency. May be repeated for credit. The Staff* Not offered in 2018-19[Return to top]Revised: 07/15/18
